Title,Url,Date
What Is Data Scraping And How Can You Use It?,https://targetinternet.com/resources/what-is-data-scraping-and-how-can-you-use-it,13 de set. de 2017
Data Scraping from Websites to Excel | Web Scraper Chorme ...,https://www.youtube.com/watch?v=aClnnoQK9G0,20 de ago. de 2021
How To Use ChatGPT To Fully Automate Web Scraping,https://www.youtube.com/watch?v=e9oOj5jRHrM,24 de jan. de 2023
Web Scraping with Python - Beautiful Soup Crash Course,https://www.youtube.com/watch?v=XVv6mJpFOb0,18 de nov. de 2020
Web Scraping qualquer coisa #5 - YouTube,https://www.youtube.com/watch?v=SsEwC5AAlLw,8 de set. de 2021
What is data scraping? - YouTube,https://www.youtube.com/watch?v=COeMzrSYgvw,30 de out. de 2020
Como extrair notícias da internet com Python? | Web Scraping ...,https://www.youtube.com/watch?v=XEGa6wVh8Sk,4 de nov. de 2022
Instant Data Scraper Chorme Extension | Learn Web Scraping,https://www.youtube.com/watch?v=Y5lodOYAURY,16 de ago. de 2021
Industrial-scale Web Scraping with AI & Proxy Networks,https://www.youtube.com/watch?v=qo_fUjb02ns,1 mês atrás
Web Scraping Using Python | GeeksforGeeks - YouTube,https://www.youtube.com/watch?v=O6nnVHPjcJU,14 de abr. de 2021
AWESOME Excel trick to scrape data from web automatically,https://www.youtube.com/watch?v=lFx0MkyBZsg,19 de jul. de 2022
Aprenda Web Scraping de maneira fácil - YouTube,https://www.youtube.com/watch?v=OpX5Y7dzNjI,26 de mar. de 2021
WEB SCRAPING com R - Parte 1 - YouTube,https://www.youtube.com/watch?v=gQyUtdVE6Mo,8 de out. de 2020
COMO FAZER DATA SCRAPING USANDO UIPATH? - YouTube,https://www.youtube.com/watch?v=XB3qkGbWW5U,13 de dez. de 2022
Web Scraping com PHP | A Forma mais FÁCIL! - YouTube,https://www.youtube.com/watch?v=DIDEKb4HDY8,19 de abr. de 2021
10 FREE Web Scrapers That You Cannot Miss in 2023,https://www.octoparse.com/blog/9-free-web-scrapers-that-you-cannot-miss,19 de jun. de 2022
Como fazer web scraping no Azure Data Factory - YouTube,https://www.youtube.com/watch?v=A4_FIUDM8QQ,10 de mai. de 2022
Amazon Web Scraping Using Python | Data Analyst Portfolio ...,https://www.youtube.com/watch?v=HiOtQMcI5wg,24 de ago. de 2021
Want To Learn Web Scraping? Start HERE - YouTube,https://www.youtube.com/watch?v=EJNJ5_i_zu8,12 de dez. de 2021
Build a Web Scraper (super simple!) - YouTube,https://www.youtube.com/watch?v=-3lqUHeZs_0,26 de set. de 2021
Web Scraping in Power Automate for Desktop (Full Tutorial),https://www.youtube.com/watch?v=WXK0u2yXLrU,25 de mai. de 2022
Python para análise de dados - #84 Web Scraping - YouTube,https://www.youtube.com/watch?v=-gYtVlpITSA,6 de ago. de 2022
Web Scraper intro tutorial - YouTube,https://www.youtube.com/watch?v=n7fob_XVsbY,25 de jun. de 2019
Web Scraping qualquer coisa #1 - YouTube,https://www.youtube.com/watch?v=jvZIxrMmOcQ,31 de jul. de 2020
Web Scraping qualquer coisa #1 - YouTube,https://www.youtube.com/watch?v=jvZIxrMmOcQ,31 de jul. de 2020
Scrapy Course – Python Web Scraping for Beginners - YouTube,https://www.youtube.com/watch?v=mBoX_JCKZTE,1 mês atrás
How to do Data Scraping in UiPath - Full Tutorial - YouTube,https://www.youtube.com/watch?v=94vxID7MBOM,21 de abr. de 2022
What is Web Scraping and What is it Used For? - YouTube,https://www.youtube.com/watch?v=Ct8Gxo8StBU,27 de set. de 2019
#07 WEB SCRAPING COM PYTHON + GOOGLE SHEETS NO ...,https://www.youtube.com/watch?v=3lsH72L-7dE,4 de dez. de 2020
Introdução à Ciência de Dados - Introdução Web Scraping,https://www.youtube.com/watch?v=WUOgfssS1cg,25 de out. de 2021
Data Scraping for Research Purposes - YouTube,https://www.youtube.com/watch?v=_mTGWquOEos,3 de abr. de 2022
What is Web Scraping? (And Why Everyone Should Learn It),https://www.youtube.com/watch?v=dlj_QL-ENJM,25 de jan. de 2022
Iniciação ao Web Scraping - Puxar dados da internet para ...,https://www.youtube.com/watch?v=Nds13psie_s,13 de jan. de 2018
What is Web Scraping and What is it Used For? | ParseHub,https://www.parsehub.com/blog/what-is-web-scraping/,14 de abr. de 2023
How to Scrape Data from Websites into Excel - YouTube,https://www.youtube.com/watch?v=uSxM2MXO0HI,30 de mai. de 2022
Web Scraping Techniques: How to Scrape Data from the Internet,https://www.youtube.com/watch?v=WgfUrqMbokE,25 de mar. de 2021
Getting started with Scraping Browser - Bright Data,https://help.brightdata.com/hc/en-us/articles/13362921219729-Getting-started-with-Scraping-Browser,1 de mar. de 2023
"The easiest website SCRAPER of the year, Browse.ai is here ...",https://www.youtube.com/watch?v=nNrKFiaxilM,11 de jul. de 2022
What is Data Scraping? #shorts - YouTube,https://www.youtube.com/watch?v=pazspHyE618,28 de out. de 2021
What is web scraping and how does it work? Learn the Basics ...,https://www.youtube.com/watch?v=5ablp0lEtIQ,23 de mar. de 2020
Scraper APIs: Easily Scraping Large Amounts of Data - YouTube,https://www.youtube.com/watch?v=Z6_DT6oS-fs,16 de dez. de 2021
Python na Prática fazendo Web Scraping (de ... - YouTube,https://www.youtube.com/watch?v=Vxl5jUltHBo,13 de fev. de 2020
Web Scraping Using Python (Step-By-Step Tutorial) - YouTube,https://www.youtube.com/watch?v=mDveiNIpqyw,3 de dez. de 2020
Power BI Web Scraping – Capturando informações dos MVPs ...,https://www.youtube.com/watch?v=JF1fFTCMi30,24 de jan. de 2019
Crawling e Scraping MUITO FÁCIL com JavaScript ... - YouTube,https://www.youtube.com/watch?v=xianIw6PleE,26 de nov. de 2020
Web Scraping | Scraping Youtube Videos,https://www.youtube.com/watch?v=rY0ZC7OaCvs,6 de jun. de 2019
Top 10 Most Scraped Websites in 2023 | Octoparse,https://www.octoparse.com/blog/top-10-most-scraped-websites,13 de dez. de 2022
Improve your Data Analysis by Web Scraping with Python,https://www.youtube.com/watch?v=eJt2uOPd9ZQ,25 de jan. de 2022
Como Usar Web Scraper para Automatizar Esses 7 Hacks de ...,https://neilpatel.com/br/blog/como-usar-web-scraper/,28 de fev. de 2018
Web scraping for Beginners | Introduction guide - ParseHub,https://www.parsehub.com/blog/beginners-guide-to-web-scraping/,17 de nov. de 2020
